bookName,starRating,bookPrice in (EUR),imageLink
Ender's Game (The Ender Quintet #1),One,43.64,http://books.toscrape.com/media/cache/8a/0d/8a0d251ccece436f956df676c99e70f7.jpg
Diary of a Citizen Scientist: Chasing Tiger Beetles and Other New Ways of Engaging the World,One,28.41,http://books.toscrape.com/media/cache/33/4f/334fd0ebdf0c0192baf5914d199c53b5.jpg
Death by Leisure: A Cautionary Tale,Four,37.51,http://books.toscrape.com/media/cache/7d/16/7d16c126f85826628bf9dcccd7a66b32.jpg
Brilliant Beacons: A History of the American Lighthouse,Three,11.45,http://books.toscrape.com/media/cache/56/cb/56cb66d73fb438d64af14dce8bd8b22b.jpg
Brazen: The Courage to Find the You That's Been Hiding,Two,19.22,http://books.toscrape.com/media/cache/3a/4f/3a4fb30cfc5742f4726bc9f807b66cda.jpg
"A Murder Over a Girl: Justice, Gender, Junior High",Three,13.20,http://books.toscrape.com/media/cache/56/31/56313728d302c83f2a8c70fba635ce33.jpg
"""Most Blessed of the Patriarchs"": Thomas Jefferson and the Empire of the Imagination",Five,44.48,http://books.toscrape.com/media/cache/11/af/11af7fbd6aec06a75fe207fae92b17e0.jpg
You Are a Badass: How to Stop Doubting Your Greatness and Start Living an Awesome Life,Three,12.08,http://books.toscrape.com/media/cache/9e/15/9e15d7add5090ff2a17bd71ac96aa55a.jpg
Wildlife of New York: A Five-Borough Coloring Book,Two,22.14,http://books.toscrape.com/media/cache/0c/07/0c07b114195b45c156f7f1e23820c49a.jpg
What Happened on Beale Street (Secrets of the South Mysteries #2),Five,25.37,http://books.toscrape.com/media/cache/c7/ab/c7abb5e32bd37118a87523dcee0a70a6.jpg
Unreasonable Hope: Finding Faith in the God Who Brings Purpose to Your Pain,Two,46.33,http://books.toscrape.com/media/cache/8b/10/8b102daec94d1ea9c6fc36dd3ec1c1fe.jpg
Under the Tuscan Sun,Three,37.33,http://books.toscrape.com/media/cache/98/c2/98c2e95c5fd1a4e7cd5f2b63c52826cb.jpg
Toddlers Are A**holes: It's Not Your Fault,One,25.55,http://books.toscrape.com/media/cache/4c/30/4c3041def6f29659e009f61e45e492b0.jpg
The Year of Living Biblically: One Man's Humble Quest to Follow the Bible as Literally as Possible,One,34.72,http://books.toscrape.com/media/cache/8e/43/8e4335b369bdad5ccc1551e5592f89ac.jpg
The Whale,Four,35.96,http://books.toscrape.com/media/cache/6c/18/6c18ea03e294bfcfe07cf531c6c5f5b3.jpg
The Story of Art,Four,41.14,http://books.toscrape.com/media/cache/bb/36/bb364a10868756d1c0877c928b43b533.jpg
The Origin of Species,Four,10.01,http://books.toscrape.com/media/cache/da/0d/da0d13699a090516502257a4d7da623f.jpg
The Great Gatsby,Four,36.05,http://books.toscrape.com/media/cache/28/cb/28cb7a5e23c1339a0d6aafd5e7e190d6.jpg
The Good Girl,Three,49.03,http://books.toscrape.com/media/cache/e2/71/e2718be90a081b33d2606a386b073998.jpg
The Glass Castle,One,16.24,http://books.toscrape.com/media/cache/e0/e9/e0e97d416322d9728df7d9e589d6a998.jpg
The Faith of Christopher Hitchens: The Restless Soul of the World's Most Notorious Atheist,One,39.55,http://books.toscrape.com/media/cache/cc/a4/cca4e6a4cd5c207e7ce7d992ff464c3b.jpg
The Drowning Girls,Three,35.67,http://books.toscrape.com/media/cache/f5/d9/f5d90537f3bed5ad7c8971190beb0730.jpg
The Constant Princess (The Tudor Court #1),Three,16.62,http://books.toscrape.com/media/cache/fc/80/fc80b999ff4b8ef24b7071f62d2bf6d1.jpg
The Bourne Identity (Jason Bourne #1),Four,42.78,http://books.toscrape.com/media/cache/40/8d/408d93b27ce8c9cfb3bf66c17e9a54ab.jpg
The Art Book,Two,32.34,http://books.toscrape.com/media/cache/99/51/99511f4da1a4a2114e2ed12e6ba17b65.jpg
The 7 Habits of Highly Effective People: Powerful Lessons in Personal Change,Four,33.17,http://books.toscrape.com/media/cache/c9/c3/c9c3d568ff6ddb98bde01c9d0b1d920a.jpg
Team of Rivals: The Political Genius of Abraham Lincoln,Five,20.12,http://books.toscrape.com/media/cache/56/75/567575381760b5c1ec018d10d350fc5f.jpg
Steal Like an Artist: 10 Things Nobody Told You About Being Creative,Two,20.90,http://books.toscrape.com/media/cache/5f/17/5f17f0e06d7d67717eff3833d309a233.jpg
"Sit, Stay, Love",Three,20.90,http://books.toscrape.com/media/cache/8e/40/8e408552c2e7ee81cd60c03c79f604af.jpg
Sister Dear,Four,40.20,http://books.toscrape.com/media/cache/fa/57/fa570b7a0fb42252f61e1e750c79d417.jpg
Raymie Nightingale,Two,34.41,http://books.toscrape.com/media/cache/8f/66/8f66ec46e671d6fca79649c10c7c8f8a.jpg
Playing from the Heart,One,32.38,http://books.toscrape.com/media/cache/1c/eb/1cebdf525ebe970a1dc3c5a8c50eae6b.jpg
"Naturally Lean: 125 Nourishing Gluten-Free, Plant-Based Recipes--All Under 300 Calories",Five,11.38,http://books.toscrape.com/media/cache/e6/b6/e6b66353f9325518994dd8b564290fd7.jpg
Meternity,Three,43.58,http://books.toscrape.com/media/cache/39/e3/39e33ebef2d7a35dd6899541eba8306d.jpg
Memoirs of a Geisha,Three,49.67,http://books.toscrape.com/media/cache/41/80/4180406c788ff3e0f37cd4491a260a5b.jpg
Like Never Before (Walker Family #2),Two,28.77,http://books.toscrape.com/media/cache/17/e2/17e264d978942f73b859fa1c1d2cf827.jpg
Life of Pi,Four,13.22,http://books.toscrape.com/media/cache/e7/ae/e7aee104ca78dac961bd906294fe88f1.jpg
King's Folly (The Kinsman Chronicles #1),Five,39.61,http://books.toscrape.com/media/cache/3e/2d/3e2d526ee062008ab1cbf54f90a5abb2.jpg
How to Cook Everything Vegetarian: Simple Meatless Recipes for Great Food (How to Cook Everything),Four,46.01,http://books.toscrape.com/media/cache/59/2d/592dc2dee11b798780f5ae613b970a34.jpg
How to Be a Domestic Goddess: Baking and the Art of Comfort Cooking,Two,28.25,http://books.toscrape.com/media/cache/e2/5c/e25cbc27ebc12e47cdf3f7adc87cccdc.jpg
Good in Bed (Cannie Shapiro #1),Five,37.05,http://books.toscrape.com/media/cache/1d/f4/1df443b1bd6d7a1d804b4780a666438f.jpg
"Fruits Basket, Vol. 7 (Fruits Basket #7)",One,19.57,http://books.toscrape.com/media/cache/b4/36/b43672509477baa090e57ebeacbb28fb.jpg
For the Love: Fighting for Grace in a World of Impossible Standards,Three,45.13,http://books.toscrape.com/media/cache/a7/d8/a7d8fda2a874567aab8f61b2b141a5e2.jpg
Finding God in the Ruins: How God Redeems Pain,Two,46.64,http://books.toscrape.com/media/cache/ae/2c/ae2ce9662ed6da3de501ff87551ccb2d.jpg
Every Heart a Doorway (Every Heart A Doorway #1),Five,12.16,http://books.toscrape.com/media/cache/50/d4/50d41a24990208deb72c9802a6c1e540.jpg
Delivering the Truth (Quaker Midwife Mystery #1),Four,20.89,http://books.toscrape.com/media/cache/57/31/5731a5d46c2c1e88977eb5e6d1337a2e.jpg
Counted With the Stars (Out from Egypt #1),Five,17.97,http://books.toscrape.com/media/cache/32/2c/322c1f6cce6d5a69a7d2321779195a0c.jpg
Blue Like Jazz: Nonreligious Thoughts on Christian Spirituality,One,25.77,http://books.toscrape.com/media/cache/a2/f5/a2f5b5fd4421d56d37c73a7fb29f5f40.jpg
Ship Leaves Harbor: Essays on Travel by a Recovering Journeyman,Three,30.60,http://books.toscrape.com/media/cache/31/b0/31b0e0a42826b326e43235beb8ddd783.jpg
Pride and Prejudice,Four,19.27,http://books.toscrape.com/media/cache/c8/09/c80991f861675b6e75dc7f2f6a50e5a0.jpg
Musicophilia: Tales of Music and the Brain,One,46.58,http://books.toscrape.com/media/cache/02/66/02667c5b8f5a5e9e45c0799518f086ca.jpg
Mere Christianity,Three,48.51,http://books.toscrape.com/media/cache/d2/90/d29093abd0b9d5258e2e08b731778158.jpg
Me Before You (Me Before You #1),One,19.02,http://books.toscrape.com/media/cache/a2/cd/a2cd0016b37c0407059147e58e14afe5.jpg
In the Woods (Dublin Murder Squad #1),Two,38.38,http://books.toscrape.com/media/cache/24/a1/24a175dac7cb91ff26e2d723cdc6e098.jpg
In Cold Blood,Four,49.98,http://books.toscrape.com/media/cache/eb/4e/eb4ea9c04dccab509451ba31feb6b4e8.jpg
How to Stop Worrying and Start Living,Five,46.49,http://books.toscrape.com/media/cache/4f/08/4f08f7948770912e4e340e10caa604cb.jpg
Give It Back,Two,18.32,http://books.toscrape.com/media/cache/8b/7c/8b7c73e075cc687b6890dc0dca9fcbcc.jpg
"Girl, Interrupted",Three,42.14,http://books.toscrape.com/media/cache/f9/ec/f9ec97bd8b29cc4e36d6c2b093d04709.jpg
"Fruits Basket, Vol. 6 (Fruits Basket #6)",Four,20.96,http://books.toscrape.com/media/cache/94/1a/941a14dec32f0a949c38a325a715c138.jpg
Deception Point,Four,40.32,http://books.toscrape.com/media/cache/fa/2d/fa2d3198b7ba9785e0edd6f41b84d72b.jpg
"Death Note, Vol. 6: Give-and-Take (Death Note #6)",Three,36.39,http://books.toscrape.com/media/cache/07/5c/075c210f5ce43b84d29646a54529d1bd.jpg
Better Homes and Gardens New Cook Book,Three,39.61,http://books.toscrape.com/media/cache/75/82/7582e20b84f603358a8d55cd6a0a50f4.jpg
An Unquiet Mind: A Memoir of Moods and Madness,Three,21.30,http://books.toscrape.com/media/cache/00/29/002924b764dc367dcaa3486fa4c0aa0b.jpg
World Without End (The Pillars of the Earth #2),Four,32.97,http://books.toscrape.com/media/cache/be/7c/be7ce6fbc9a8e1a5a5b5c32e73cfd78a.jpg
The Dream Thieves (The Raven Cycle #2),One,34.50,http://books.toscrape.com/media/cache/d9/7a/d97a3a4a65b5275ab506b28c7a88e0a5.jpg
"Will Grayson, Will Grayson (Will Grayson, Will Grayson)",Four,47.31,http://books.toscrape.com/media/cache/de/a1/dea174c8a8dbfd98e5e05c9e479a52b2.jpg
Why Save the Bankers?: And Other Essays on Our Economic and Political Crisis,Two,48.67,http://books.toscrape.com/media/cache/16/f5/16f545b2e14c16ed4bd0e098a0700b57.jpg
Where She Went (If I Stay #2),Four,41.73,http://books.toscrape.com/media/cache/05/86/0586b3d79013f606494e843de1faea0b.jpg
Two Summers,One,14.64,http://books.toscrape.com/media/cache/89/16/89165d7488fbaa9e60cfcabe56796288.jpg
The Darkest Corners,Five,11.33,http://books.toscrape.com/media/cache/c1/ab/c1ab73a20d02b5f3a5599e7c5704a909.jpg
The Crossover,Four,38.77,http://books.toscrape.com/media/cache/9f/35/9f351ca1978128c60a3b7f85987075b3.jpg
The 5th Wave (The 5th Wave #1),Two,11.83,http://books.toscrape.com/media/cache/10/d0/10d0c5e47d0e8cce16b6b5e6be48cb16.jpg
Benjamin Franklin: An American Life,Three,48.19,http://books.toscrape.com/media/cache/25/f8/25f869fa75340fca0fc2a68e8a0412a1.jpg
This Is Your Brain on Music: The Science of a Human Obsession,One,38.40,http://books.toscrape.com/media/cache/35/a4/35a4a7c6c76c4e82186753078e441654.jpg
The Secret Garden,Four,15.08,http://books.toscrape.com/media/cache/c5/46/c5465a06182ed6ebfa40d049258a2f58.jpg
The Raven King (The Raven Cycle #4),Two,30.57,http://books.toscrape.com/media/cache/da/54/da54d953f00d1e465f31f865df3d0f3f.jpg
The Power Greens Cookbook: 140 Delicious Superfood Recipes,Five,11.05,http://books.toscrape.com/media/cache/82/1d/821d2c02dcd0a10fc9d533917482746e.jpg
Tell the Wind and Fire,Three,45.51,http://books.toscrape.com/media/cache/3b/0c/3b0c5f4df26b73659af4e25107499384.jpg
Tell Me Three Things,One,41.81,http://books.toscrape.com/media/cache/a1/2f/a12f0bec8c8728800f901b4e5f6e3f9a.jpg
Talking to Girls About Duran Duran: One Young Man's Quest for True Love and a Cooler Haircut,Four,25.15,http://books.toscrape.com/media/cache/07/8b/078b934613af473daf7ecf918e05d050.jpg
Siddhartha,Five,34.22,http://books.toscrape.com/media/cache/ce/0b/ce0be2d86e388540122c222306c6d62c.jpg
"At The Existentialist Café: Freedom, Being, and apricot cocktails with: Jean-Paul Sartre, Simone de Beauvoir, Albert Camus, Martin Heidegger, Edmund Husserl, Karl Jaspers, Maurice Merleau-Ponty and others",Five,29.93,http://books.toscrape.com/media/cache/de/76/de76d5c473c358bd41c03cf710692bfb.jpg
A Summer In Europe,Two,44.34,http://books.toscrape.com/media/cache/4e/15/4e15150388702ebca2c5a523ac270539.jpg
A Gathering of Shadows (Shades of Magic #2),Four,44.81,http://books.toscrape.com/media/cache/48/b2/48b20fcc9ab722729de2c4da3d4de26e.jpg
The Rise and Fall of the Third Reich: A History of Nazi Germany,Two,39.67,http://books.toscrape.com/media/cache/e1/02/e102cefae5bb523bc67eb6b49bc18b5d.jpg
The Metamorphosis,One,28.58,http://books.toscrape.com/media/cache/4a/1b/4a1b6e9c1af75db0dc34ae63344f6883.jpg
The Mathews Men: Seven Brothers and the War Against Hitler's U-boats,Five,42.91,http://books.toscrape.com/media/cache/f2/64/f26457d65a03b2636c4bcc7c318f7346.jpg
The Little Paris Bookshop,Three,24.73,http://books.toscrape.com/media/cache/50/a9/50a901fb008c0b8965c8d4da2dff5470.jpg
The Grand Design,Three,13.76,http://books.toscrape.com/media/cache/08/a9/08a957eb34f8047862e225774c3bdde2.jpg
The Firm,Three,45.56,http://books.toscrape.com/media/cache/95/84/95847132a78de44b7249a2d0a3fe3ef6.jpg
The Fault in Our Stars,One,47.22,http://books.toscrape.com/media/cache/69/61/696100859e82b2ec7a796129d6cca44a.jpg
The Expatriates,Two,44.58,http://books.toscrape.com/media/cache/db/e4/dbe49e1cb06136eeb51182f551ccdc52.jpg
Shiver (The Wolves of Mercy Falls #1),Five,16.23,http://books.toscrape.com/media/cache/84/73/847399651d8f2dfae1a0d5a0ea4064b2.jpg
Remember Me?,Three,11.48,http://books.toscrape.com/media/cache/3f/95/3f9572f94858197e92786b194f0f12df.jpg
Red Dragon (Hannibal Lecter #1),Three,23.37,http://books.toscrape.com/media/cache/30/66/3066f8bcd2e2ed6b45084355ff084a61.jpg
Peak: Secrets from the New Science of Expertise,Two,16.28,http://books.toscrape.com/media/cache/83/ab/83ab65f938b24fa1a9cb47235be49b57.jpg
My Mother Was Nuts,Four,31.63,http://books.toscrape.com/media/cache/9b/b4/9bb42bf833e91193ca05badddded4bfb.jpg
Mexican Today: New and Rediscovered Recipes for Contemporary Kitchens,Five,24.91,http://books.toscrape.com/media/cache/5d/02/5d029bff299cdb777e06f35800faa628.jpg
The Mysterious Affair at Styles (Hercule Poirot #1),Four,24.80,http://books.toscrape.com/media/cache/32/94/3294e5eaf73a37958583483fc9a90f04.jpg
The Makings of a Fatherless Child,Two,31.58,http://books.toscrape.com/media/cache/6f/6c/6f6c7560e254f8242f86ef048f1ba7b3.jpg
The Joy of Cooking,Four,43.27,http://books.toscrape.com/media/cache/05/8e/058ebff59d12ebe40df1844bedd9366b.jpg
The Invention of Wings,One,37.34,http://books.toscrape.com/media/cache/62/fa/62fa1e72f06f05762db5d9cedf654153.jpg
The Hobbit (Middle-Earth Universe),Five,17.80,http://books.toscrape.com/media/cache/8b/d3/8bd38de5367fc675467431f343862569.jpg
The Great Railway Bazaar,One,30.54,http://books.toscrape.com/media/cache/76/de/76de41867f323d7f1f4fbe2fdfc1b2ba.jpg
Isla and the Happily Ever After (Anna and the French Kiss #3),Five,48.13,http://books.toscrape.com/media/cache/0d/0b/0d0bd1fce3e0171cf101764393caea41.jpg
If I Stay (If I Stay #1),Five,38.13,http://books.toscrape.com/media/cache/cb/b3/cbb3754c7bae0d54dcf561aed4f9d6e3.jpg
I Know Why the Caged Bird Sings (Maya Angelou's Autobiography #1),Two,36.55,http://books.toscrape.com/media/cache/c1/42/c14297e48de02ac420c587822ff329ab.jpg
Harry Potter and the Deathly Hallows (Harry Potter #7),One,23.32,http://books.toscrape.com/media/cache/58/e4/58e434a6a4eb267eac7aa529b0c2ec15.jpg
"Fruits Basket, Vol. 5 (Fruits Basket #5)",One,16.33,http://books.toscrape.com/media/cache/51/cf/51cf19c74f21a7043910615fefcf0847.jpg
Foundation (Foundation (Publication Order) #1),One,32.42,http://books.toscrape.com/media/cache/8b/92/8b9267df86378b6973974ae7e1924ffe.jpg
Fool Me Once,One,16.96,http://books.toscrape.com/media/cache/b6/9c/b69c4ea86e09921aabc4e0431a8273a5.jpg
Find Her (Detective D.D. Warren #8),One,22.37,http://books.toscrape.com/media/cache/f6/f2/f6f2094e8a318093fa53784df2bfeab8.jpg
Evicted: Poverty and Profit in the American City,One,42.27,http://books.toscrape.com/media/cache/d0/4f/d04f8176cf0527b293114173d01999d7.jpg
Drama,Two,38.70,http://books.toscrape.com/media/cache/68/ce/68ce8be6a167f510d07a7da637b62c6f.jpg
Dracula the Un-Dead,Five,35.63,http://books.toscrape.com/media/cache/13/ff/13fffcde653948339d3427184b7bd0b5.jpg
"Data, A Love Story: How I Gamed Online Dating to Meet My Match",Three,32.35,http://books.toscrape.com/media/cache/1f/d8/1fd8340d9b3fd95861f0407b4dbb0fa7.jpg
Critique of Pure Reason,One,20.75,http://books.toscrape.com/media/cache/12/6e/126ef8f6473b81808ebbb9cff155e883.jpg
Booked,Five,17.49,http://books.toscrape.com/media/cache/8f/46/8f46bb13feb3a4440a27dfcf688fbaa6.jpg
Maybe Something Beautiful: How Art Transformed a Neighborhood,One,22.54,http://books.toscrape.com/media/cache/c0/bb/c0bb6e42743b9c1aaf9b754501100a5d.jpg
Lola and the Boy Next Door (Anna and the French Kiss #2),Four,23.63,http://books.toscrape.com/media/cache/bc/c8/bcc8374e0c81ded1486b6225ca4fe78a.jpg
Logan Kade (Fallen Crest High #5.5),Two,13.12,http://books.toscrape.com/media/cache/d9/4e/d94e6206c2decd3acd9a61b2cbac7eaf.jpg
Killing Floor (Jack Reacher #1),Four,31.49,http://books.toscrape.com/media/cache/eb/e9/ebe9f06ccebf83d9853a846052b58fff.jpg
Kill the Boy Band,Five,15.52,http://books.toscrape.com/media/cache/05/74/0574a71ccaff1fef1f8e9a1f4c22b7bc.jpg
The Golden Compass (His Dark Materials #1),One,18.77,http://books.toscrape.com/media/cache/e7/9f/e79f81bfea1cb8b0503db022b64da713.jpg
The God Delusion,Three,46.85,http://books.toscrape.com/media/cache/36/64/36643d44134c8a227988927013805e61.jpg
The Girl You Left Behind (The Girl You Left Behind #1),One,15.79,http://books.toscrape.com/media/cache/d0/b6/d0b6d59c0662dcbd15d47add40af1ebd.jpg
The Fellowship of the Ring (The Lord of the Rings #1),Two,10.27,http://books.toscrape.com/media/cache/ed/75/ed75000b92734d99b76a17954857327c.jpg
The Collected Poems of W.B. Yeats (The Collected Works of W.B. Yeats #1),Five,15.42,http://books.toscrape.com/media/cache/7e/93/7e934132cd03486649fb492fe702f704.jpg
"Blue Lily, Lily Blue (The Raven Cycle #3)",Five,34.13,http://books.toscrape.com/media/cache/db/14/db14903b3a56a297ef6aefe7624d637f.jpg
An Abundance of Katherines,Five,10.00,http://books.toscrape.com/media/cache/ed/45/ed4517339d4780f4158c485c83850d20.jpg
A Girl's Guide to Moving On (New Beginnings #2),One,31.30,http://books.toscrape.com/media/cache/f7/a9/f7a90a63f66ac92cc280def001970ed2.jpg
A Game of Thrones (A Song of Ice and Fire #1),Two,46.42,http://books.toscrape.com/media/cache/13/d1/13d11b26b46484ee73e9923ff307a7b4.jpg
A Feast for Crows (A Song of Ice and Fire #4),Four,17.21,http://books.toscrape.com/media/cache/b3/6b/b36b278233baf55ebaad761d8d3d0fec.jpg
A Clash of Kings (A Song of Ice and Fire #2),Three,10.79,http://books.toscrape.com/media/cache/1a/29/1a298a157f4113d6e0127521aaa1f5f0.jpg
The Shining (The Shining #1),Three,27.88,http://books.toscrape.com/media/cache/db/96/db9686744f93c0e9ff3945144827f99a.jpg
The Passion of Dolssa,Five,28.32,http://books.toscrape.com/media/cache/6b/82/6b822681c4035131560d40dd3b5a6a2e.jpg
The Jazz of Physics: The Secret Link Between Music and the Structure of the Universe,Three,38.71,http://books.toscrape.com/media/cache/2d/32/2d32efe1c5f97510596a2cc21c5daf5d.jpg
The Hunger Games (The Hunger Games #1),Five,29.85,http://books.toscrape.com/media/cache/41/c7/41c72a9c7733fc5f7434b2fa33060c54.jpg
The Hound of the Baskervilles (Sherlock Holmes #5),Two,14.82,http://books.toscrape.com/media/cache/1f/b0/1fb03cdabe6001c8a2620f65e025cbd5.jpg
The Gunning of America: Business and the Making of American Gun Culture,Four,16.81,http://books.toscrape.com/media/cache/28/a8/28a8784d0b38b148a35bce421dc16910.jpg
The Geography of Bliss: One Grump's Search for the Happiest Places in the World,Two,28.23,http://books.toscrape.com/media/cache/bd/a0/bda0fa21e6d06862920c0eedecc6201e.jpg
"The Demon Prince of Momochi House, Vol. 4 (The Demon Prince of Momochi House #4)",Two,27.88,http://books.toscrape.com/media/cache/47/71/477173fe3000a6da4b241c2e71a21418.jpg
Shopaholic Ties the Knot (Shopaholic #3),Five,48.39,http://books.toscrape.com/media/cache/ac/ba/acba5e4e1813b8c1fff4890f1efef3ab.jpg
Paper and Fire (The Great Library #2),Five,49.45,http://books.toscrape.com/media/cache/a7/04/a704d4248b21c0cdd8038c1b8345ed17.jpg
The Beast (Black Dagger Brotherhood #14),Five,46.08,http://books.toscrape.com/media/cache/1b/3f/1b3f5057f9e7f7cb81a8c10b58024145.jpg
Some Women,Five,13.73,http://books.toscrape.com/media/cache/27/b7/27b7f4ec590965b5acc15dc4b1376684.jpg
Outlander (Outlander #1),Five,19.67,http://books.toscrape.com/media/cache/b1/0b/b10ba73e67297fc8ed9e877bdcf60813.jpg
"Orchestra of Exiles: The Story of Bronislaw Huberman, the Israel Philharmonic, and the One Thousand Jews He Saved from Nazi Horrors",Three,12.36,http://books.toscrape.com/media/cache/15/de/15de75548ee9a4c6be1420ee309c03e0.jpg
No One Here Gets Out Alive,Five,20.02,http://books.toscrape.com/media/cache/7a/7e/7a7eb52e7075a5305522948375c1316e.jpg
Night Shift (Night Shift #1-20),Four,12.75,http://books.toscrape.com/media/cache/c0/02/c0029d48c2588e6d2a6a31c9f96088ba.jpg
Needful Things,Four,47.51,http://books.toscrape.com/media/cache/2d/e0/2de0eff716ca13d12cf5420e88e1a8b3.jpg
Mockingjay (The Hunger Games #3),Four,20.44,http://books.toscrape.com/media/cache/76/b4/76b462eda7a84ccf39a543d63c695ca7.jpg
Misery,Two,34.79,http://books.toscrape.com/media/cache/7c/93/7c9302e392e128881e926d19f761da33.jpg
Little Women (Little Women #1),Four,28.07,http://books.toscrape.com/media/cache/81/f5/81f559ebe403317226fa8b611e35ce8a.jpg
It,Three,25.01,http://books.toscrape.com/media/cache/f7/b7/f7b73392b12909a1e8261ef3f96c5fd1.jpg
Harry Potter and the Sorcerer's Stone (Harry Potter #1),Three,13.90,http://books.toscrape.com/media/cache/04/c8/04c8a51d23d4335d300324e917ca4d8f.jpg
Harry Potter and the Prisoner of Azkaban (Harry Potter #3),Four,24.17,http://books.toscrape.com/media/cache/d1/fb/d1fbdddb0d4fb0c445a33c6d003d0990.jpg
Harry Potter and the Order of the Phoenix (Harry Potter #5),Four,31.63,http://books.toscrape.com/media/cache/96/11/9611147982037cd7d79483452938c10f.jpg
Harry Potter and the Half-Blood Prince (Harry Potter #6),Five,48.75,http://books.toscrape.com/media/cache/c8/24/c8248518fb59de3a798a4b5baae949b5.jpg
Harry Potter and the Chamber of Secrets (Harry Potter #2),One,14.74,http://books.toscrape.com/media/cache/fc/08/fc08dcfc1ae86bbd5bc0bca74c9b6d3d.jpg
Gone with the Wind,Three,32.49,http://books.toscrape.com/media/cache/27/82/2782701b5c877cb063065b9fc14c5b13.jpg
God Is Not Great: How Religion Poisons Everything,One,27.80,http://books.toscrape.com/media/cache/d2/80/d280aed3d0c46653a9c33f76559e9e6d.jpg
Far From True (Promise Falls Trilogy #2),Two,34.93,http://books.toscrape.com/media/cache/87/54/8754267f27581996f93e8d94d3c04bf9.jpg
Dark Lover (Black Dagger Brotherhood #1),One,12.87,http://books.toscrape.com/media/cache/3c/a2/3ca2e61181fc1122658af8f85354bae8.jpg
Confessions of a Shopaholic (Shopaholic #1),Two,48.94,http://books.toscrape.com/media/cache/e3/b5/e3b5a3dcc2993295f5a6fb429052799c.jpg
Changing the Game (Play by Play #2),Three,13.38,http://books.toscrape.com/media/cache/57/47/57472d9c6d483bee9c38c90bfa10b3ee.jpg
Can You Keep a Secret?,One,21.94,http://books.toscrape.com/media/cache/72/73/7273ff1bfe3b0a6aab7f54ddf9be7b44.jpg
Girl With a Pearl Earring,One,26.77,http://books.toscrape.com/media/cache/b7/ad/b7ad37d93d8401c84d7325aa645ff6d5.jpg
Atlas Shrugged,Five,26.58,http://books.toscrape.com/media/cache/a5/4f/a54fea8d034eba2ee4d1b8af30f1a308.jpg
"A History of God: The 4,000-Year Quest of Judaism, Christianity, and Islam",One,27.62,http://books.toscrape.com/media/cache/71/91/7191a7d76eb6c3a18259541e2c038ae3.jpg
'Salem's Lot,Four,49.56,http://books.toscrape.com/media/cache/ee/d3/eed3afc5e444e3da5eec34e2b0036ec7.jpg
Zero History (Blue Ant #3),One,34.77,http://books.toscrape.com/media/cache/74/52/74524b04dc99cbfc7bf5d37fcc1489ab.jpg
Wuthering Heights,Three,17.73,http://books.toscrape.com/media/cache/93/4e/934e966c1ddf559d3ac2b5c1407aaf1e.jpg
World War Z: An Oral History of the Zombie War,One,21.80,http://books.toscrape.com/media/cache/7e/bf/7ebfa1c62b21beeaad37a6474a39cfe8.jpg
Wild: From Lost to Found on the Pacific Crest Trail,Three,46.02,http://books.toscrape.com/media/cache/c8/41/c841873951efb18dea28162452efff58.jpg
"Where'd You Go, Bernadette",One,18.13,http://books.toscrape.com/media/cache/c6/7e/c67eb0d6e56c4459e8c0d45c08471a89.jpg
When You Are Engulfed in Flames,Five,30.89,http://books.toscrape.com/media/cache/73/36/733662595aede2dff1a5be1e76a3b936.jpg
We the People: The Modern-Day Figures Who Have Reshaped and Affirmed the Founding Fathers' Vision of America,Three,31.95,http://books.toscrape.com/media/cache/f6/52/f65271ce557e9192537e24847bbb1210.jpg
We Are All Completely Beside Ourselves,One,24.04,http://books.toscrape.com/media/cache/4d/18/4d1891e435c6692c864331c585e0d014.jpg
Walk the Edge (Thunder Road #2),Three,32.36,http://books.toscrape.com/media/cache/61/2c/612ce7fa4cbee472392ce8721a4e863e.jpg
Voyager (Outlander #3),Five,21.07,http://books.toscrape.com/media/cache/b5/d8/b5d813da01f2ccd7bcfe34e2b875e752.jpg
Vegan Vegetarian Omnivore: Dinner for Everyone at the Table,Two,13.66,http://books.toscrape.com/media/cache/80/63/80631f8bca036361343fdce528725654.jpg
Under the Banner of Heaven: A Story of Violent Faith,One,30.00,http://books.toscrape.com/media/cache/14/2f/142f99787241bb65e031a76e74e14d1b.jpg
Two Boys Kissing,Two,32.74,http://books.toscrape.com/media/cache/53/bd/53bd80b1fc1914f418dc31a9d6571cb1.jpg
Twilight (Twilight #1),Two,41.93,http://books.toscrape.com/media/cache/70/10/7010c24f80a4172f7405677ef0592f26.jpg
Twenties Girl,Two,42.80,http://books.toscrape.com/media/cache/a0/fa/a0fa38039f6a674a7c89dfe2be866259.jpg
Three-Martini Lunch,Three,23.21,http://books.toscrape.com/media/cache/1d/8e/1d8eb8aaebd14464fc58a681091b8d45.jpg
"Thinking, Fast and Slow",One,21.14,http://books.toscrape.com/media/cache/b4/a5/b4a56663d56f1e84ee1b15bd819563cc.jpg
"The Wicked + The Divine, Vol. 3: Commercial Suicide (The Wicked + The Divine)",Three,14.41,http://books.toscrape.com/media/cache/ee/ed/eeeddf8af9e6cc8c7f71c0e41de1b562.jpg
The Undomestic Goddess,Four,45.75,http://books.toscrape.com/media/cache/13/8f/138f4cf84be250d08e1f5c1db3643dbc.jpg
The Travelers,One,15.77,http://books.toscrape.com/media/cache/2a/a8/2aa8afd15f97617ab75f616766161cda.jpg
The Tipping Point: How Little Things Can Make a Big Difference,Two,10.02,http://books.toscrape.com/media/cache/27/3d/273d4c813111bc482e8c473ebd90fbbb.jpg
The Thing About Jellyfish,One,48.77,http://books.toscrape.com/media/cache/e0/90/e090748ce5a567207aed9185c97eb34b.jpg
The Smitten Kitchen Cookbook,One,23.59,http://books.toscrape.com/media/cache/8e/09/8e09faaea71886048b27959e607e6c7b.jpg
The Silkworm (Cormoran Strike #2),Five,23.05,http://books.toscrape.com/media/cache/3a/2c/3a2c46cd40a7ecbd7c40815d6390fb8a.jpg
