bookName,starRating,bookPrice in (EUR),imageLink
The Road to Little Dribbling: Adventures of an American in Britain (Notes From a Small Island #2),One,23.21,http://books.toscrape.com/media/cache/e0/4f/e04f8eda2a2fa947aec17640202d9ab0.jpg
The Rise of Theodore Roosevelt (Theodore Roosevelt #1),Three,42.57,http://books.toscrape.com/media/cache/ff/d4/ffd45d95f314555e20c923d3522adea7.jpg
The Restaurant at the End of the Universe (Hitchhiker's Guide to the Galaxy #2),One,10.92,http://books.toscrape.com/media/cache/b8/b2/b8b2956acc758a381beef87339c0a52f.jpg
The Rest Is Noise: Listening to the Twentieth Century,One,34.77,http://books.toscrape.com/media/cache/4d/e1/4de1d174bf4ab498788c9488c9fd29fc.jpg
The Red Tent,Five,35.66,http://books.toscrape.com/media/cache/b2/8f/b28f211e50e74445ca071d4279d1080d.jpg
The Purpose Driven Life: What on Earth Am I Here for?,Three,37.19,http://books.toscrape.com/media/cache/95/08/9508e6b28fe4c63e67b3ef33f11eff98.jpg
The Purest Hook (Second Circle Tattoos #3),One,12.25,http://books.toscrape.com/media/cache/15/68/1568ef85fdb4e405b9f8bc62ef855c10.jpg
The Picture of Dorian Gray,Two,29.70,http://books.toscrape.com/media/cache/a6/72/a67245346daa38c2b23a4fc64c6e7115.jpg
The Paris Wife,Three,36.80,http://books.toscrape.com/media/cache/01/c8/01c847671683538fcf084eede54d6270.jpg
The Obsession,One,45.43,http://books.toscrape.com/media/cache/24/93/2493c74c614afcc435cc00e33bd55f64.jpg
The Nightingale,Four,26.26,http://books.toscrape.com/media/cache/77/aa/77aa0ef1f62a0b0b40000a81f65c4e65.jpg
The New Guy (and Other Senior Year Distractions),Three,44.92,http://books.toscrape.com/media/cache/d8/9d/d89dc869d5ea1462fd746ac6de97583f.jpg
The Name of God is Mercy,Two,37.25,http://books.toscrape.com/media/cache/d2/41/d241ca89679593a589a6614162ab6eb6.jpg
The Lean Startup: How Today's Entrepreneurs Use Continuous Innovation to Create Radically Successful Businesses,Three,33.92,http://books.toscrape.com/media/cache/39/f1/39f167dff90d7f84f5c8dc5e05d4051b.jpg
"The Land of 10,000 Madonnas",Four,29.64,http://books.toscrape.com/media/cache/ae/93/ae93b007df22c99ea2ff2f907b06663e.jpg
The Maze Runner (The Maze Runner #1),One,20.93,http://books.toscrape.com/media/cache/5e/87/5e87e44785de47c2a03091deaa82330f.jpg
The Lonely Ones,Five,43.59,http://books.toscrape.com/media/cache/21/bd/21bdf7ae21476b1debf4aa3eefe6f29d.jpg
The Infinities,One,27.41,http://books.toscrape.com/media/cache/9c/44/9c445b33d53b3810f1c12f4adad71a27.jpg
The Hitchhiker's Guide to the Galaxy (Hitchhiker's Guide to the Galaxy #1),Three,47.80,http://books.toscrape.com/media/cache/41/74/41747f533b211d324799a03dc64ed175.jpg
The Guns of August,Two,14.54,http://books.toscrape.com/media/cache/06/c8/06c897070611b78b80a37333cbb7851c.jpg
The Guernsey Literary and Potato Peel Pie Society,One,49.53,http://books.toscrape.com/media/cache/18/f7/18f7bf6366cd7a8b947fd790d808047b.jpg
The Goldfinch,Three,43.58,http://books.toscrape.com/media/cache/fb/4d/fb4dde3351d00ef104f29aeecd2d41fb.jpg
The Giver (The Giver Quartet #1),One,12.30,http://books.toscrape.com/media/cache/b3/ed/b3eda9490c9e2ed02c3a8650e687731b.jpg
The Girl with All the Gifts,Three,49.47,http://books.toscrape.com/media/cache/41/c7/41c74d82b853606fe98182c417b4669c.jpg
The Girl Who Played with Fire (Millennium Trilogy #2),Two,22.14,http://books.toscrape.com/media/cache/11/71/117145e4525b2e801e2cd1ba4dd70441.jpg
The Exiled,Three,43.45,http://books.toscrape.com/media/cache/2d/1a/2d1aeb1cc8a23064164e230fa232cc04.jpg
"The End of Faith: Religion, Terror, and the Future of Reason",Four,22.13,http://books.toscrape.com/media/cache/9d/56/9d5631724c6496b2f012fa5d2f2b6abd.jpg
"The Elegant Universe: Superstrings, Hidden Dimensions, and the Quest for the Ultimate Theory",Four,13.03,http://books.toscrape.com/media/cache/69/c8/69c83860995cde393dbe6690ec3f1d4f.jpg
The Devil Wears Prada (The Devil Wears Prada #1),One,44.29,http://books.toscrape.com/media/cache/87/d3/87d34d376555dd0cb75030d1059cc144.jpg
The Day the Crayons Came Home (Crayons),Five,26.33,http://books.toscrape.com/media/cache/ec/08/ec08efebaa33a403e54080b48c139794.jpg
The Da Vinci Code (Robert Langdon #2),Two,22.96,http://books.toscrape.com/media/cache/cf/d5/cfd553eaa00f4d6091c459081cd98199.jpg
The Cuckoo's Calling (Cormoran Strike #1),One,19.21,http://books.toscrape.com/media/cache/11/81/11815f24d043f77d4f09a3522a688a5c.jpg
The Complete Stories and Poems (The Works of Edgar Allan Poe [Cameo Edition]),Four,26.78,http://books.toscrape.com/media/cache/42/c4/42c48f11b7e70a0f76c5ba9cb5c5018a.jpg
The Complete Poems,Five,41.32,http://books.toscrape.com/media/cache/e5/f2/e5f270cf4a079a7d411439abe17691e0.jpg
The Catcher in the Rye,One,24.55,http://books.toscrape.com/media/cache/70/f4/70f4dbf8110363f4e7ef32db0ce2a675.jpg
The Cat in the Hat (Beginner Books B-1),Two,16.26,http://books.toscrape.com/media/cache/9b/f1/9bf106306301a44635aa7bd381c84e4d.jpg
The Case for Christ (Cases for Christianity),One,47.84,http://books.toscrape.com/media/cache/12/3d/123d05986974943a58c5cfa518e11e6d.jpg
The Book of Basketball: The NBA According to The Sports Guy,Five,44.84,http://books.toscrape.com/media/cache/61/2c/612caeb0b2acb35c100629f0f52a40d7.jpg
The Autobiography of Malcolm X,Two,23.43,http://books.toscrape.com/media/cache/84/07/84074b59293cc5bf4012ef0f60e90c4f.jpg
"The Art of Simple Food: Notes, Lessons, and Recipes from a Delicious Revolution",Three,34.32,http://books.toscrape.com/media/cache/96/57/9657c6d89024e343879a7b5512474f1e.jpg
The Art of Fielding,One,22.10,http://books.toscrape.com/media/cache/68/a6/68a6112c857e595c684f2a1a3287ba16.jpg
"Surely You're Joking, Mr. Feynman!: Adventures of a Curious Character",Two,25.83,http://books.toscrape.com/media/cache/f8/bc/f8bcd489d33473e0819beaecccd5ebac.jpg
Stiff: The Curious Lives of Human Cadavers,Three,36.74,http://books.toscrape.com/media/cache/a0/a0/a0a013b029130df92073f547df83ee5c.jpg
Spilled Milk: Based on a True Story,One,49.51,http://books.toscrape.com/media/cache/a8/0d/a80d4310cab08a3660149fd3f2cf15c7.jpg
Something Borrowed (Darcy & Rachel #1),Five,48.96,http://books.toscrape.com/media/cache/6d/6d/6d6d5799190b4f9ef89f3bbc8b67d60d.jpg
Soldier (Talon #3),Two,24.72,http://books.toscrape.com/media/cache/7b/96/7b96f6e11b388ee800c7fd17fe479444.jpg
Shopaholic & Baby (Shopaholic #5),Two,46.45,http://books.toscrape.com/media/cache/f0/a4/f0a48c8cc6acd322eacd9d35e55d63e7.jpg
Seven Brief Lessons on Physics,Four,30.60,http://books.toscrape.com/media/cache/c8/63/c863c222c130a1bc8685a1242dd2523d.jpg
Scarlet (The Lunar Chronicles #2),Four,14.57,http://books.toscrape.com/media/cache/b6/5c/b65c3622c0da689990fd1d7f1a0b826c.jpg
Sarah's Key,One,46.29,http://books.toscrape.com/media/cache/95/b2/95b235aeeae2d1849b78562f36e10aec.jpg
"Saga, Volume 3 (Saga (Collected Editions) #3)",Five,21.57,http://books.toscrape.com/media/cache/d8/fd/d8fd30b3e5781e880a3efe4c9495b417.jpg
Running with Scissors,Four,12.91,http://books.toscrape.com/media/cache/66/c7/66c7a1537c8901e1e4ec217d1956bae8.jpg
"Rise of the Rocket Girls: The Women Who Propelled Us, from Missiles to the Moon to Mars",Four,41.67,http://books.toscrape.com/media/cache/05/42/05428b0c7b79d0dbc521fd621e754083.jpg
Rework,Two,44.88,http://books.toscrape.com/media/cache/54/10/5410a58193e2373c04b3021ade78a82b.jpg
Reservations for Two,Three,11.10,http://books.toscrape.com/media/cache/39/a4/39a4d96a5bc75a34aae97676a4b854fa.jpg
Red: The True Story of Red Riding Hood,Three,28.54,http://books.toscrape.com/media/cache/70/4e/704e81b05e56dd84ecf607ea283952db.jpg
Ready Player One,Four,19.07,http://books.toscrape.com/media/cache/51/34/513418bd1c6114f3ea1fd703278e20ef.jpg
Quiet: The Power of Introverts in a World That Can't Stop Talking,One,43.55,http://books.toscrape.com/media/cache/ee/3a/ee3aebe36d1d0fa11a95a07067294b8c.jpg
Prodigy: The Graphic Novel (Legend: The Graphic Novel #2),Three,43.63,http://books.toscrape.com/media/cache/c9/a5/c9a559e3ba407c1d70ebfc4e2f0d82db.jpg
Persepolis: The Story of a Childhood (Persepolis #1-2),One,39.13,http://books.toscrape.com/media/cache/14/98/14987a55d9609e706d2619814e2a8b0a.jpg
Outliers: The Story of Success,One,14.16,http://books.toscrape.com/media/cache/70/37/70372ab3240019fbe2de6cd407c98675.jpg
Original Fake,Three,31.45,http://books.toscrape.com/media/cache/e7/29/e72934871f9b42a807d976670a446e12.jpg
Orange Is the New Black,Two,24.61,http://books.toscrape.com/media/cache/d9/ea/d9ea34aea25469189bca07af6a18790a.jpg
One for the Money (Stephanie Plum #1),Two,32.87,http://books.toscrape.com/media/cache/4e/52/4e52f087337abef25de62845f093ed6e.jpg
Notes from a Small Island (Notes From a Small Island #1),One,40.17,http://books.toscrape.com/media/cache/61/39/61393c43f7caaccaa07daccaa8530736.jpg
Night (The Night Trilogy #1),One,13.51,http://books.toscrape.com/media/cache/e3/cc/e3ccf96311f9c1b9e9ecc80e16c05f4e.jpg
Neither Here nor There: Travels in Europe,Three,38.95,http://books.toscrape.com/media/cache/06/81/0681530a7bc301caf5c3257e1b0f0750.jpg
Naked,Three,31.69,http://books.toscrape.com/media/cache/e7/12/e71268a559d73826aa64151d47357a12.jpg
Morning Star (Red Rising #3),One,29.40,http://books.toscrape.com/media/cache/b5/f0/b5f04530d0343e763a80ef3f2dbdb386.jpg
Manuscript Found in Accra,Two,34.98,http://books.toscrape.com/media/cache/26/b7/26b72a3c1cf2a8afdbe92fa1a1d78f41.jpg
Lust & Wonder,Two,11.87,http://books.toscrape.com/media/cache/61/ba/61ba5bc1ee3d8cb3dd350120ffa3f31e.jpg
Lila (Gilead #3),Three,12.47,http://books.toscrape.com/media/cache/2b/99/2b99a765a013979637b4a6726bfb10f5.jpg
"Life, the Universe and Everything (Hitchhiker's Guide to the Galaxy #3)",Two,33.26,http://books.toscrape.com/media/cache/ef/8b/ef8bc5adcd3bea8e8ba97be76d07a32a.jpg
Life After Life,Two,26.13,http://books.toscrape.com/media/cache/59/80/59803a88c2e5dd7a2e36de1d41f7f1ae.jpg
Letter to a Christian Nation,One,22.20,http://books.toscrape.com/media/cache/74/c2/74c2893188f917409ba564d46f481f77.jpg
Let's Pretend This Never Happened: A Mostly True Memoir,One,45.11,http://books.toscrape.com/media/cache/78/e1/78e1b9ccc99ba11d78015f0a18f0b421.jpg
Legend (Legend #1),Four,43.69,http://books.toscrape.com/media/cache/6c/6c/6c6c0984ab57d6b4f71d84dd0db0f65b.jpg
"Lean In: Women, Work, and the Will to Lead",One,25.02,http://books.toscrape.com/media/cache/4f/e5/4fe55bc7134401f6db04f0775ead1d4c.jpg
Jurassic Park (Jurassic Park #1),One,44.97,http://books.toscrape.com/media/cache/9a/71/9a7160b396790bd4a351522278de4f8c.jpg
It's Never Too Late to Begin Again: Discovering Creativity and Meaning at Midlife and Beyond,One,42.38,http://books.toscrape.com/media/cache/fa/36/fa3659740e31eb57775cc2647654bf11.jpg
Is Everyone Hanging Out Without Me? (And Other Concerns),Three,20.11,http://books.toscrape.com/media/cache/6b/94/6b94e98f822a42c03c4ff0b9cfdd6e0c.jpg
Inferno (Robert Langdon #4),Five,41.00,http://books.toscrape.com/media/cache/e3/11/e3111146083821b5a3670d869ab40d2a.jpg
"In the Garden of Beasts: Love, Terror, and an American Family in Hitler's Berlin",Three,28.85,http://books.toscrape.com/media/cache/25/82/2582a9f11ad68a30e44cc0b459383474.jpg
If I Run (If I Run #1),Four,49.97,http://books.toscrape.com/media/cache/c3/d0/c3d0f2fb5cacbca64639a679b962e1b9.jpg
I've Got Your Number,One,19.69,http://books.toscrape.com/media/cache/b2/df/b2df826432771838819db89c20e20609.jpg
I Am Malala: The Girl Who Stood Up for Education and Was Shot by the Taliban,Two,28.88,http://books.toscrape.com/media/cache/52/7a/527a7d3b9b4928c093cadd75661bf467.jpg
Hungry Girl Clean & Hungry: Easy All-Natural Recipes for Healthy Eating in the Real World,Three,33.14,http://books.toscrape.com/media/cache/6f/c4/6fc450625cd672e871a6176f74909be2.jpg
"House of Lost Worlds: Dinosaurs, Dynasties, and the Story of Life on Earth",Two,43.70,http://books.toscrape.com/media/cache/43/fd/43fda1db93163d67705264dcfa98aaa5.jpg
Horrible Bear!,Two,37.52,http://books.toscrape.com/media/cache/d2/63/d26337dee5c0b13b56b7aea59d611570.jpg
Heir to the Sky,Four,44.07,http://books.toscrape.com/media/cache/6d/b1/6db1568e09d10652593638a5f85e7202.jpg
Green Eggs and Ham (Beginner Books B-16),Four,10.79,http://books.toscrape.com/media/cache/3a/0e/3a0e75e4f758f90a80965869afbe41b4.jpg
"Grayson, Vol 3: Nemesis (Grayson #3)",One,42.72,http://books.toscrape.com/media/cache/f9/4c/f94cfc3c82abb799568d1ea029b1d3d1.jpg
Gratitude,Five,26.66,http://books.toscrape.com/media/cache/07/b6/07b673e7d367a5e89418bd513a8d5e72.jpg
Gone Girl,Five,37.60,http://books.toscrape.com/media/cache/24/ad/24ad42075b1aa1403aef934c29c1e8ba.jpg
Golden (Heart of Dread #3),Four,42.21,http://books.toscrape.com/media/cache/39/2f/392fedbcda7bf8f968d5e6643ea5545f.jpg
Girl in the Blue Coat,Two,46.83,http://books.toscrape.com/media/cache/bf/7a/bf7a5bc1d1ebac5e9b6fbb147828a123.jpg
"Fruits Basket, Vol. 3 (Fruits Basket #3)",Two,45.17,http://books.toscrape.com/media/cache/7b/e7/7be75475a916d6df4edebfc5fe36c3f9.jpg
Fire Bound (Sea Haven/Sisters of the Heart #5),Four,21.28,http://books.toscrape.com/media/cache/cd/53/cd53431a069ee01572988de29ef68da5.jpg
Fifty Shades Freed (Fifty Shades #3),Five,15.36,http://books.toscrape.com/media/cache/18/d8/18d8e02c75c2ef23556c9746fae57e43.jpg
Fellside,One,38.62,http://books.toscrape.com/media/cache/f4/8f/f48f179d6bda290b66b2d165e0a419e6.jpg
Extreme Prey (Lucas Davenport #26),Three,25.40,http://books.toscrape.com/media/cache/de/86/de86d4f1563fad2ca088922fbbb2b36a.jpg
Eragon (The Inheritance Cycle #1),Three,43.87,http://books.toscrape.com/media/cache/2d/62/2d625f26cb3bbeef851221f125b81daf.jpg
Eclipse (Twilight #3),One,18.74,http://books.toscrape.com/media/cache/05/f8/05f833af99c37decb506e34e36f5cdaf.jpg
Disrupted: My Misadventure in the Start-Up Bubble,Five,15.28,http://books.toscrape.com/media/cache/2c/32/2c32dd01215c98fc1f6b176b6a9b3ece.jpg
Dead Wake: The Last Crossing of the Lusitania,Five,39.24,http://books.toscrape.com/media/cache/69/0e/690ee5b7ef94ea460861eee2e67fd787.jpg
"David and Goliath: Underdogs, Misfits, and the Art of Battling Giants",One,17.81,http://books.toscrape.com/media/cache/df/95/df9520adbabbb17f22fcb3f49c69640f.jpg
Dark Places,Five,23.90,http://books.toscrape.com/media/cache/51/bf/51bf575f9af355f4f9f98abe8986402a.jpg
Crazy Rich Asians (Crazy Rich Asians #1),Five,49.13,http://books.toscrape.com/media/cache/9a/62/9a621372fed3a80015283013d8a452cd.jpg
Counting Thyme,One,10.62,http://books.toscrape.com/media/cache/e0/ae/e0ae97753a73b88b61b13b19977613dc.jpg
Cosmos,Two,36.17,http://books.toscrape.com/media/cache/65/7b/657b1d20ea50775c5c87e039ed8aeebc.jpg
Cinder (The Lunar Chronicles #1),One,26.09,http://books.toscrape.com/media/cache/4e/d2/4ed2ec75df84ba1093fc4141b29abab3.jpg
Catastrophic Happiness: Finding Joy in Childhood's Messy Years,Two,37.35,http://books.toscrape.com/media/cache/7d/0b/7d0bb832760e81c281d8d283ba6a2b09.jpg
Career of Evil (Cormoran Strike #3),Two,24.72,http://books.toscrape.com/media/cache/9e/ff/9eff8b66d583e8f0ba58a0bc86de40f2.jpg
Breaking Dawn (Twilight #4),Five,35.28,http://books.toscrape.com/media/cache/ce/24/ce242d3eb00bf1938d6c18e0261ef868.jpg
Boy Meets Boy,Three,21.12,http://books.toscrape.com/media/cache/0b/ac/0baceb72d202880d1441a32193df6e11.jpg
"Born to Run: A Hidden Tribe, Superathletes, and the Greatest Race the World Has Never Seen",Two,27.35,http://books.toscrape.com/media/cache/ea/ee/eaee98b302dcaf91d1122816ae553295.jpg
Blink: The Power of Thinking Without Thinking,Five,21.74,http://books.toscrape.com/media/cache/5d/41/5d415bc31b1f856a2a9dc8706fd19abd.jpg
Black Flags: The Rise of ISIS,One,40.87,http://books.toscrape.com/media/cache/48/5d/485d2c4cedd639fcb005340a8d589bb3.jpg
"Black Butler, Vol. 1 (Black Butler #1)",One,49.31,http://books.toscrape.com/media/cache/99/48/9948564dec3ac2f9e32419911b181e37.jpg
Big Little Lies,One,22.11,http://books.toscrape.com/media/cache/ef/b7/efb72b546fc7cab4ba1735b4b82c5851.jpg
Between Shades of Gray,Five,20.79,http://books.toscrape.com/media/cache/f9/19/f919f64fc0e3642cdc604134bfd93774.jpg
Best of My Love (Fool's Gold #20),Two,27.41,http://books.toscrape.com/media/cache/06/8c/068ccab8875670fccb8b72234370d16f.jpg
Beowulf,Two,38.35,http://books.toscrape.com/media/cache/dd/6e/dd6e7b84e99f3b4b5655ea0db74af2b4.jpg
Beautiful Creatures (Caster Chronicles #1),Five,21.55,http://books.toscrape.com/media/cache/82/06/8206f351bd1ff6f52eed515a3b366916.jpg
Awkward,Two,38.02,http://books.toscrape.com/media/cache/41/72/417255e608c389aedfb68491dae92c9c.jpg
Ash,Four,22.06,http://books.toscrape.com/media/cache/d7/f0/d7f00033bda3779b2fd017e32e7c800c.jpg
Are We There Yet?,Three,10.66,http://books.toscrape.com/media/cache/f8/be/f8be3238a1cf039a3e7d50de1d4c2cfd.jpg
Annie on My Mind,Five,36.83,http://books.toscrape.com/media/cache/88/ba/88baf408218bf1e31626211da4329c6b.jpg
And Then There Were None,Two,35.01,http://books.toscrape.com/media/cache/21/bf/21bf2eb0bff3134837def8bd40845ba0.jpg
A Walk in the Woods: Rediscovering America on the Appalachian Trail,Four,30.48,http://books.toscrape.com/media/cache/25/ff/25ffbe6f0e8961a1cb2ace38a5b02279.jpg
A Visit from the Goon Squad,Five,14.08,http://books.toscrape.com/media/cache/92/02/9202adfd4bc39e4058c5b9e851ffbf5a.jpg
A Storm of Swords (A Song of Ice and Fire #3),Two,31.22,http://books.toscrape.com/media/cache/39/83/3983449f17095ed15a4878d6bc8114c9.jpg
8 Keys to Mental Health Through Exercise,One,31.04,http://books.toscrape.com/media/cache/b8/44/b844a77409f1d53cbb66148820abc217.jpg
"The Suffragettes (Little Black Classics, #96)",Two,11.89,http://books.toscrape.com/media/cache/ee/c3/eec3857d573218bfd22b23b80bfe740e.jpg
The Sense of an Ending,Three,31.38,http://books.toscrape.com/media/cache/75/46/7546899e546c4aa11b501c0c41060727.jpg
The Course of Love,Three,16.78,http://books.toscrape.com/media/cache/f2/c9/f2c952cfbce6ab5d8400a0bb8ee4eb5c.jpg
Sugar Rush (Offensive Line #2),One,24.42,http://books.toscrape.com/media/cache/c3/a9/c3a90a5baa833a37c29c4b03a444737c.jpg
"Saga, Volume 2 (Saga (Collected Editions) #2)",Three,11.75,http://books.toscrape.com/media/cache/1a/eb/1aeb5d30809ad96d7c323228a2bd23d3.jpg
"Fruits Basket, Vol. 2 (Fruits Basket #2)",Five,11.64,http://books.toscrape.com/media/cache/e9/fb/e9fb3236b73384253144f89b6eec6a68.jpg
"Y: The Last Man, Vol. 1: Unmanned (Y: The Last Man #1)",Four,18.51,http://books.toscrape.com/media/cache/ae/16/ae169bb5ae814e0fb900cdf9e99332a7.jpg
While You Were Mine,Five,41.32,http://books.toscrape.com/media/cache/45/e8/45e87bcad554d79eadf0f89df9cac6f9.jpg
"Run, Spot, Run: The Ethics of Keeping Pets",One,20.02,http://books.toscrape.com/media/cache/91/e6/91e6190dcdd7d6cdeb94a82b60917ec4.jpg
New Moon (Twilight #2),Four,12.86,http://books.toscrape.com/media/cache/5a/1f/5a1fa3ec68add137878b42243813263d.jpg
Life,Five,31.58,http://books.toscrape.com/media/cache/99/97/9997eda658c2fe50e724171f9c2a2b0b.jpg
Kindle Paperwhite User's Guide,Three,34.00,http://books.toscrape.com/media/cache/3e/49/3e49769bf9bf83d3bb25c6f93a7fcca2.jpg
The Secret Healer,Three,34.56,http://books.toscrape.com/media/cache/69/d2/69d225899cce0a150c605ead01e02f60.jpg
The Republic,Three,33.78,http://books.toscrape.com/media/cache/7b/2c/7b2cb77c4608fce189caebaa842e135d.jpg
The Odyssey,Three,29.64,http://books.toscrape.com/media/cache/0d/e8/0de8211253c4131e0caf9e8528d99443.jpg
The Nicomachean Ethics,One,36.34,http://books.toscrape.com/media/cache/f0/aa/f0aa9ae0319b1d6e0706e6053020e696.jpg
Where Lightning Strikes (Bleeding Stars #3),Three,39.77,http://books.toscrape.com/media/cache/73/d9/73d948af3f2adb6dd693ff4bd43e7760.jpg
Ways of Seeing,Five,39.51,http://books.toscrape.com/media/cache/a8/3a/a83a4d31d30dc3cb26a29899a5c3b91d.jpg
"Vampire Knight, Vol. 1 (Vampire Knight #1)",One,15.40,http://books.toscrape.com/media/cache/4b/97/4b972f89c11900ac0e84726d1f07bfcc.jpg
Twenty Love Poems and a Song of Despair,Four,30.95,http://books.toscrape.com/media/cache/df/ab/dfab1d94f9190df7c13b63a093a6d16e.jpg
Three Wishes (River of Time: California #1),Two,44.18,http://books.toscrape.com/media/cache/c7/21/c721943edf481cad5ab32505e2ad3865.jpg
This One Moment (Pushing Limits #1),One,48.71,http://books.toscrape.com/media/cache/9b/06/9b061431c4fbb98cc18068a523a49988.jpg
The Mirror & the Maze (The Wrath and the Dawn #1.5),One,29.38,http://books.toscrape.com/media/cache/84/a8/84a85a5ecca2bdc17e219241938ebdba.jpg
The Little Prince,Two,45.42,http://books.toscrape.com/media/cache/c0/78/c078355608dd81c7c5e4f5e1c5f73d23.jpg
The Last Girl (The Dominion Trilogy #1),Two,36.26,http://books.toscrape.com/media/cache/da/47/da4746e620f8ccd7cf20628d1a5e535a.jpg
The Iliad,One,16.16,http://books.toscrape.com/media/cache/b4/49/b449e504e387b69322d85e76a57ab60f.jpg
The Hook Up (Game On #1),Five,36.29,http://books.toscrape.com/media/cache/38/f1/38f1543cd2d51c2728678f5ecc128958.jpg
The Haters,Five,27.89,http://books.toscrape.com/media/cache/4c/e9/4ce9f937ac784ae0b377bcbf2a38a8b2.jpg
The Girl You Lost,Five,12.29,http://books.toscrape.com/media/cache/90/0d/900dba6987796f4312a6a6737b0ea94d.jpg
The Girl In The Ice (DCI Erika Foster #1),Three,15.85,http://books.toscrape.com/media/cache/d8/f7/d8f77fe7f4bb8610e903741441f84702.jpg
The Zombie Room,Five,19.69,http://books.toscrape.com/media/cache/1a/2d/1a2d5e478c6b33738ff17e7acfbd8b66.jpg
"The Wicked + The Divine, Vol. 1: The Faust Act (The Wicked + The Divine)",Two,36.52,http://books.toscrape.com/media/cache/64/75/64752f8cdae54b164fb81bfd81accd55.jpg
The Tumor,Five,41.56,http://books.toscrape.com/media/cache/db/f4/dbf4f5d4e7c0364b078aa5ce7e196853.jpg
The Story of Hong Gildong,Four,43.19,http://books.toscrape.com/media/cache/ab/16/ab16eb035cc58809a73c4699477de9cb.jpg
The Silent Wife,Five,12.34,http://books.toscrape.com/media/cache/9b/a3/9ba37429e4a2307fe0b2f4f4162dd636.jpg
The Silent Twin (Detective Jennifer Knight #3),Three,36.25,http://books.toscrape.com/media/cache/a0/7b/a07b53e1708f9055145aa1ec3af8608d.jpg
The Selfish Gene,One,29.45,http://books.toscrape.com/media/cache/08/14/0814f26516fb72b7391d0a742b5928a2.jpg
The Bette Davis Club,Three,30.66,http://books.toscrape.com/media/cache/23/08/2308bf77130cf0a917642d82dbf4be05.jpg
The Art of Not Breathing,Four,40.83,http://books.toscrape.com/media/cache/37/26/3726bb1bf30241b6d6f8c8488ad70989.jpg
The End of the Jesus Era (An Investigation #1),One,14.40,http://books.toscrape.com/media/cache/fe/47/fe47782c4f8194a4d93ec1381108be88.jpg
The Edge of Reason (Bridget Jones #2),Four,19.18,http://books.toscrape.com/media/cache/db/34/db341aa83daa76cd9f9bd2c86ccb5dba.jpg
The Complete Maus (Maus #1-2),Three,10.64,http://books.toscrape.com/media/cache/a6/f8/a6f889e0ba02be31875d3a324090ef5e.jpg
The Communist Manifesto,Three,14.76,http://books.toscrape.com/media/cache/bb/cd/bbcd1a94ebc9fb56f8d079df4557f8e2.jpg
Taking Shots (Assassins #1),Two,18.88,http://books.toscrape.com/media/cache/ea/92/ea92404bce04a4bc76f3ed9c5344b2bf.jpg
Starlark,Three,25.83,http://books.toscrape.com/media/cache/b4/9e/b49e66e8f446d9a3dae488955f2aa487.jpg
"Skip Beat!, Vol. 01 (Skip Beat! #1)",Three,42.12,http://books.toscrape.com/media/cache/6c/60/6c607509837e2b362ffd7c0e15e7b1f9.jpg
Sister Sable (The Mad Queen #1),Three,13.33,http://books.toscrape.com/media/cache/2c/89/2c89c4c5528ab4b9101701437953df75.jpg
Shatter Me (Shatter Me #1),One,42.40,http://books.toscrape.com/media/cache/f0/31/f031254cafbdff0092c76c8dcba24139.jpg
Shadow Rites (Jane Yellowrock #10),Four,21.72,http://books.toscrape.com/media/cache/7a/0d/7a0d52ec06a57c117c0b99c7980756e7.jpg
Settling the Score (The Summer Games #1),Two,44.91,http://books.toscrape.com/media/cache/9b/4e/9b4ece2ab5a6335c8594c878e2f22df1.jpg
Sense and Sensibility,One,37.46,http://books.toscrape.com/media/cache/7d/53/7d53e2264b9647ee307259be9f73585d.jpg
"Saga, Volume 1 (Saga (Collected Editions) #1)",One,28.48,http://books.toscrape.com/media/cache/c6/ca/c6cab3f679acb45fd2eba092ec9f6a2a.jpg
"Rhythm, Chord & Malykhin",Two,28.34,http://books.toscrape.com/media/cache/43/85/4385ee0304bc3546f2b6eaa75c46d4f8.jpg
"Rat Queens, Vol. 1: Sass & Sorcery (Rat Queens (Collected Editions) #1-5)",Five,46.96,http://books.toscrape.com/media/cache/0d/22/0d22f9ee696b7443d1573e7752645c6d.jpg
Paradise Lost (Paradise #1),One,24.96,http://books.toscrape.com/media/cache/66/f9/66f9edebe41032584e08dcf2fc27b8b4.jpg
"Paper Girls, Vol. 1 (Paper Girls #1-5)",Four,21.71,http://books.toscrape.com/media/cache/87/2b/872ba3b06a97e6662770bc2152595b84.jpg
"Ouran High School Host Club, Vol. 1 (Ouran High School Host Club #1)",Three,29.87,http://books.toscrape.com/media/cache/d5/c5/d5c5a6ebf05b68bee78a38a8ea62305d.jpg
Origins (Alphas 0.5),One,28.99,http://books.toscrape.com/media/cache/12/9b/129b70d7b45d78a26459e7445e0e13e2.jpg
On the Road (Duluoz Legend),Three,32.36,http://books.toscrape.com/media/cache/b8/3e/b83e5f1b9c1dcfe0ef05cff4b080e0fa.jpg
Off Sides (Off #1),Five,39.45,http://books.toscrape.com/media/cache/03/ed/03ed67ea504353b91b035151d8e80db2.jpg
Of Mice and Men,Two,47.11,http://books.toscrape.com/media/cache/0f/ca/0fca4597765ffacdb7bd529fc5eb88fa.jpg
My Perfect Mistake (Over the Top #1),Two,38.92,http://books.toscrape.com/media/cache/0d/03/0d03eb55ed070a53b6c4b6eedd48b458.jpg
"Ms. Marvel, Vol. 1: No Normal (Ms. Marvel (2014-2015) #1)",Four,39.39,http://books.toscrape.com/media/cache/f4/96/f496db4d78639e233978ae2bee021752.jpg
Meditations,Two,25.89,http://books.toscrape.com/media/cache/df/c9/dfc9ed72e963572d23233b3a8cb01676.jpg
Matilda,One,28.34,http://books.toscrape.com/media/cache/03/47/0347bd215f4813edd81c2cd76bab53ca.jpg
Lost Among the Living,Four,27.70,http://books.toscrape.com/media/cache/5a/40/5a40d914bc3491e5909f1167f9cb34f2.jpg
Lord of the Flies,Three,24.89,http://books.toscrape.com/media/cache/33/73/3373a168b588e3fb19c558a21da71ac9.jpg
Jane Eyre,Five,38.43,http://books.toscrape.com/media/cache/0b/9b/0b9bd2c1de5ec402b2c797b53e5257f6.jpg
Imperfect Harmony,Four,34.74,http://books.toscrape.com/media/cache/fb/29/fb299a516730a2f2602b10f945f7a8e5.jpg
Icing (Aces Hockey #2),Four,40.44,http://books.toscrape.com/media/cache/8d/1e/8d1e285bf672b2ea66879490cc5f6904.jpg
"Hawkeye, Vol. 1: My Life as a Weapon (Hawkeye #1)",Three,45.24,http://books.toscrape.com/media/cache/16/46/16460146a1a8b99c82da027368383ade.jpg
